ID,Name,Description,Type,Venue,Start Date,End Date,Host Club,Rotaract Club,Club ID,Zone,Created By,Created By Email,External Partner Clubs,External Partners,Areas of Focus,Avenues of Service,Expenses,Cash Contributions,In Kind Contributions,Participants,Beneficiaries,Volunteers,Volunteer Hours,Editorial,Showcase,Featured,Cover Photo,Photos,Created At,Updated At
b69f6765-a6f0-4f9d-a651-e17db59951b6,71st Wildlife Week Walkathon for Conservation,"The Rotaract Club of KSSEM actively participated in the 71st Wildlife Conservation Walk organized by Rotaract District 3191 in collaboration with the Government of Karnataka, Karnataka Forest Department, Bannerghatta Biological Park, Rotary Bangalore Southend, and Mysore Sandal on 2nd October 2025.

The event commenced at Vidhana Soudha and concluded at Lalbagh, covering a symbolic route that emphasized the importance of Human–Wildlife Coexistence and environmental sustainability. Over 100 enthusiastic members from our club joined the walk, proudly representing KSSEM and contributing to this meaningful initiative.

The walkathon brought together Rotaractors, Rotarians, students, and citizens, creating a strong collective voice for wildlife protection and conservation. Participants carried banners and slogans promoting harmony between humans and nature, highlighting the urgent need to safeguard our forests and biodiversity.

This large-scale awareness event served as an inspiring platform for youth engagement, encouraging participants to adopt eco-friendly practices and spread the message of coexistence within their communities.

The Rotaract Club of KSSEM takes pride in being part of this impactful initiative and remains committed to supporting causes that nurture a greener, sustainable future for all. ",PARTICIPATORY_ACTIVITY,Vidhana Soudha,02/10/2025,02/10/2025,,KSSEM,213238,Zone Ashwa,Manoj B,manojbkssem@gmail.com,,,"Protecting The Environment, Promoting Peace","Community Service, Club Service",0,0,0,100,100,25,225,No,Yes,No,https://media.3191-2525.clubstack.tixora.space/uploads/tZN_2ZDnjn22w0hFEvD99.jpg,https://media.3191-2525.clubstack.tixora.space/uploads/o9yAvOzhWaFGkV-7ulwjH.jpg | https://media.3191-2525.clubstack.tixora.space/uploads/B-qWJp1gWaWpyHt44YgA8.jpg | https://media.3191-2525.clubstack.tixora.space/uploads/VFVXNEnqThMvp3iV0UYJq.jpg | https://media.3191-2525.clubstack.tixora.space/uploads/tSlY7-Q4aoDyRef4_-DnO.jpg | https://media.3191-2525.clubstack.tixora.space/uploads/5PM3-oXMsIMZZa7l_ZfNG.jpg,2025-11-07T16:25:23.174Z,2025-11-07T16:25:23.174Z
2dd17cc9-eaba-4098-972c-72910c492d95,Jamming with SwAROCK,"The Rotaract Club of KSSEM, in collaboration with Blue Bonfire Creations, successfully organized a lively musical event titled “Jamming with SwAROCK” on 11th October 2025 at 5C Pub & Kitchen, Rajajinagar. The event was held from 6:30 PM to 8:00 PM and witnessed an enthusiastic crowd of around 60 to 70 people. The evening was filled with rhythm, energy, and pure musical vibes as the talented band SwAROCK delivered an electrifying live performance that kept the audience completely engaged. Attendees enjoyed every beat, singing along, cheering, and immersing themselves in the musical atmosphere. The collaboration with Blue Bonfire Creations added a creative and professional touch, ensuring smooth coordination and vibrant event execution. The event not only entertained everyone but also created a wonderful space for music lovers to connect, unwind, and celebrate the spirit of art and togetherness. Overall, “Jamming with SwAROCK” was a grand success, leaving the audience with smiles, memories, and the hope for more such musical evenings by the Rotaract Club of KSSEM.",HOSTED_ACTIVITY,"5C Pub & Kitchen, Rajajinagar",11/10/2025,11/10/2025,,KSSEM,213238,Zone Ashwa,Manoj B,manojbkssem@gmail.com,,,,"Public Image, Club Service",2500,0,0,70,70,10,75,Yes,Yes,No,https://media.3191-2525.clubstack.tixora.space/uploads/ldaIcxjs9wmQVBUoe2tLf.jpg,https://media.3191-2525.clubstack.tixora.space/uploads/uFvff4kEvCfz0tSTk5T5m.jpg | https://media.3191-2525.clubstack.tixora.space/uploads/xOJz3ymrMLjAGNeyZiouk.jpg | https://media.3191-2525.clubstack.tixora.space/uploads/nTl1BMSlFznPwl_wnLA3U.jpg | https://media.3191-2525.clubstack.tixora.space/uploads/NjS39vtVapjA779kZC3NM.jpg,2025-11-07T16:03:04.865Z,2025-11-07T16:03:04.865Z
4aa360aa-03c4-4162-a046-5e3542766c1d,Rendezvous 9.0,"The Rotaract Club of KSSEM proudly collaborated and actively participated in Rendezvous 9.0, organized by the Rotaract Club of Pune Mideast, RID 3131, on 25th October 2025 at 6:30 PM. The event brought together Rotaractors from various districts across India to celebrate the spirit of Diwali through culture, collaboration, and fellowship.

The session began with an engaging introduction, followed by participants from different clubs sharing how Diwali is celebrated in their respective regions — from traditional rituals and local delicacies to vibrant decorations and community gatherings. Each club’s sharing about their Diwali traditions beautifully reflected India’s cultural diversity and the essence of unity in celebration.

As part of the event, our club actively participated in the Letterhead Exchange Ceremony, symbolizing friendship and long-term partnership among Rotaract Clubs. The collaborative atmosphere encouraged cultural learning, inter-district bonding, and mutual appreciation.

Rendezvous 9.0 served as a meaningful platform to connect clubs across boundaries, exchange ideas, and celebrate India’s most cherished festival with joy and harmony. The event truly embodied the Rotaract spirit of togetherness and the Diwali message of spreading light, happiness, and hope. ✨🪔",JOINT_INITIATIVE,Online (G-Meet),25/10/2025,25/10/2025,"Rotaract Club of Pune Mideast, RID 3131",KSSEM,213238,Zone Ashwa,Manoj B,manojbkssem@gmail.com,,,,International Service,0,0,0,26,26,3,28,No,Yes,No,https://media.3191-2525.clubstack.tixora.space/uploads/V-C1lNWpA88Omt9sJE7Zv.jpg,https://media.3191-2525.clubstack.tixora.space/uploads/cwgIkVpwvbv-Xx4NSBKGx.jpg | https://media.3191-2525.clubstack.tixora.space/uploads/Ly4bVR0WRP9pb22IdUjpS.jpg | https://media.3191-2525.clubstack.tixora.space/uploads/Glo8Yw837NR7uYwGttlSf.jpg | https://media.3191-2525.clubstack.tixora.space/uploads/bZAoyLXKjlIXIG9x5IFlo.jpg | https://media.3191-2525.clubstack.tixora.space/uploads/k8n-7AhhhZgCpkSUR7fsR.jpg,2025-11-07T15:58:11.731Z,2025-11-07T15:58:11.731Z
47975610-e6e8-44f2-b326-a79bf0f8e7f1,Beyond Calories (Nutrition & Wellness),"The International Professional Session titled “Beyond Calories (Nutrition & Wellness)” was successfully conducted on 26th October 2025 at 7:00 PM IST via Google Meet, under the International Service Avenue. The event was collaboratively organized by the Rotaract Club of SVVV, RID 3040 (India), and the Rotaract Club of San Juanico, RID 3860 (Philippines).

The session was graced by Ms. Dhwani Parekh, a Clinical Nutritionist with experience alongside prominent wellness experts. She delivered an insightful talk focusing on practical nutrition knowledge, wellness optimization, and sugar control. The session highlighted how mindful eating and balanced nutrition can significantly enhance one’s lifestyle and overall well-being.

The interactive webinar drew participation from several Rotaract clubs across different districts, encouraging cross-border learning and cultural exchange. Members actively engaged through Q&A sessions, gaining valuable insights into sustainable wellness practices.

All collaborating clubs fulfilling the participation criteria received E-certificates of collaboration, symbolizing their contribution to fostering international understanding and health awareness.

The initiative, coordinated by Rtr. Harsh Saxena (International Service Director, Rotaract Club of SVVV), was appreciated for promoting global fellowship and practical learning on health and nutrition — aligning perfectly with the Rotaract spirit of “Fellowship Through Service.”",JOINT_INITIATIVE,Online (G-Meet),26/10/2025,26/10/2025,"Rotaract Club of SVVV, RID 3040 (India), and the Rotaract Club of San Juanico, RID 3860 (Philippines)",KSSEM,213238,Zone Ashwa,Manoj B,manojbkssem@gmail.com,,,Fighting Disease,Club Service,0,0,0,89,89,2,90,No,Yes,No,https://media.3191-2525.clubstack.tixora.space/uploads/1qzalnCwk3pjRKEG2GWzq.jpg,https://media.3191-2525.clubstack.tixora.space/uploads/YTgajc1JPaHNODc2-0ULA.jpg | https://media.3191-2525.clubstack.tixora.space/uploads/KMuf777IGnl747MUm1zdr.jpg | https://media.3191-2525.clubstack.tixora.space/uploads/1FkzLYZFoMb1Yre8reM0t.jpg,2025-11-07T14:24:55.360Z,2025-11-07T14:24:55.360Z
61e054f6-6507-4d8f-9395-aae1b310d9a6,Be the Reason,"The Be the Reason online awareness session, organized under Project Snehdhara by the Rotaract Club of Delhi South Central, sponsored by the Rotary Club of Delhi South Central, was successfully conducted on 18th October 2025 at 8:00 PM via Google Meet. The session aimed to promote awareness about blood, eye, and organ donation, inspiring participants to understand the power of giving and the profound impact it can have on saving lives.

The esteemed speaker for the event, Dr. Anuj Gaba (MD, Resident in Forensic Medicine and Toxicology, AIIMS Kalyani), shared insightful knowledge about the importance, safety, and process of donations. He emphasized how every donor holds the power to bring hope and a new beginning to others, dispelling myths and encouraging participants to take meaningful steps toward contributing to this noble cause.

The event witnessed enthusiastic participation from several Rotaract clubs, meeting the collaboration criteria of at least five members per club. Participants appreciated the informative and empathetic tone of the session, which not only educated but also inspired them to take part in life-saving initiatives.

Under the guidance of Rtr. Isha Parashar (Project Chair), Rtr. Sukhmani Kaur (Event Chair), Rtr. Manthan Mangla (Event Co-Chair), Rtr. Priyanshu Sharma (President), and Rtr. Jasleen Johar (Secretary), the session concluded as a heartwarming and impactful effort toward spreading compassion and awareness about the gift of life.",JOINT_INITIATIVE,Online (G-Meet),18/10/2025,18/10/2025,"Rotaract Club of Delhi South Central, RID-3011",KSSEM,213238,Zone Ashwa,Manoj B,manojbkssem@gmail.com,,,"Saving Mothers and Children, Fighting Disease",Community Service,0,0,0,75,75,5,79,No,Yes,No,https://media.3191-2525.clubstack.tixora.space/uploads/7GHgsU3r6YisbejhoE7M6.jpg,https://media.3191-2525.clubstack.tixora.space/uploads/GSm6v89E5dPplPWsE75OC.jpg | https://media.3191-2525.clubstack.tixora.space/uploads/m79tAAvuoiKbvoVRRuxCw.jpg | https://media.3191-2525.clubstack.tixora.space/uploads/7YWgP3rzXT7iFJQCI5EWv.jpg | https://media.3191-2525.clubstack.tixora.space/uploads/wfwxU90Hsl3gUQYvd9RBs.jpg | https://media.3191-2525.clubstack.tixora.space/uploads/RRQxv5Pc-vQj6WKeb3SF1.jpg,2025-11-07T14:21:06.715Z,2025-11-07T14:21:06.715Z
6509ddf0-e32f-496a-bd60-48ba15b701f0,Animal Feeding Drive,"The Animal Feeding Drive, organized under the Flagship Project REVIVE by the Rotaract Club of Dyal Singh College, RID 3012, was a compassionate initiative aimed at promoting kindness, empathy, and love towards animals. Conducted with the belief that “kindness to animals is kindness to ourselves,” the drive encouraged Rotaractors to actively contribute to the welfare of stray animals and birds.

Participants from various clubs joined hands to feed stray dogs, cats, and birds, capturing photos and videos of their acts of care and sharing them through the designated drive link. The initiative emphasized that small gestures of compassion, such as providing food or water, can create a ripple effect of positivity and awareness within the community.

The collaboration criteria required each participating club to submit a minimum of four photos or videos, earning them a Certificate of Collaboration as recognition for their contribution. The drive witnessed enthusiastic participation across multiple clubs, reflecting unity in service and a collective commitment to animal welfare.

The event successfully concluded on 29th October 2025, under the leadership of Rtr. N V Aruna Devi (President) and Rtr. Anushka (Secretary), leaving a lasting message of empathy, compassion, and the importance of coexisting harmoniously with all living beings.",JOINT_INITIATIVE,"Online ",29/10/2025,29/10/2025,"Rotaract Club of Dyal Singh College, RID 3012",KSSEM,213238,Zone Ashwa,Manoj B,manojbkssem@gmail.com,,,"Protecting The Environment, Providing Clean Water, Sanitation and Hygiene",Community Service,0,0,0,10,10,2,11,No,Yes,No,https://media.3191-2525.clubstack.tixora.space/uploads/D20H2yIkMz_3xn06iwI9A.jpg,https://media.3191-2525.clubstack.tixora.space/uploads/FIuB2O6HIbv6MXLR6eYH3.jpg | https://media.3191-2525.clubstack.tixora.space/uploads/WJoGbxl14ldYjFFBtZ2J3.jpg,2025-11-07T13:59:30.064Z,2025-11-07T13:59:30.064Z
aa3c0ab9-f88b-405b-9f72-f2fec2a6120c,The Canvas Gallery,"The Canvas Gallery, organized by the Rotaract Club of Jain Evening College, RID 3191, was a beautifully curated creative initiative that celebrated imagination, art, and expression. Conducted under the theme “Where creativity meets connection,” the event invited participants to showcase their talents through writing and visual art, fostering collaboration and artistic dialogue among Rotaractors.

Participants could select from three meaningful themes — Echoes of Youth, Chapters of Change, and The Art of Becoming — each encouraging reflection on personal growth, transformation, and self-discovery. They also chose one mode of expression per member, including short stories (150–200 words), poems, photographs, or posters.

The event followed a unique collaboration model where two members represented each club — one contributing a written piece and the other a visual — along with three additional participants from their or other clubs. The initiative successfully attracted enthusiastic participation, resulting in a rich blend of creativity and emotion across entries.

All submissions were compiled into a Digital Anthology & Gallery Showcase, giving participants recognition and a platform to share their art with a wider audience.

Spearheaded by Rtr. Lavishka Jain (ISD), The Canvas Gallery stood out as an inspiring celebration of artistic expression, unity, and storytelling within the Rotaract community.",JOINT_INITIATIVE,"Online ",21/10/2025,21/10/2025,"Rotaract Club of Jain Evening College, RID 3191",KSSEM,213238,Zone Ashwa,Manoj B,manojbkssem@gmail.com,,,Supporting Education,"Editorial/Publication, Professional Development",0,0,0,59,59,2,60,No,Yes,No,https://media.3191-2525.clubstack.tixora.space/uploads/NsF4jy1M5RUjU9KEgj34l.jpg,https://media.3191-2525.clubstack.tixora.space/uploads/wil56wO-mBJmCuDfokxFQ.jpg | https://media.3191-2525.clubstack.tixora.space/uploads/CDapDg6XDshVRB8qdK87A.jpg,2025-11-07T13:55:13.025Z,2025-11-07T17:04:18.593Z
43e12344-67a7-4aaf-8d30-b387bb51cdf5,World’s Largest Lesson,"The World’s Largest Lesson – Learning from Legacy, Leading with Purpose was an inspiring and impactful online session organized by the Rotaract Club of Rever on 22nd October 2025 from 7:00 PM to 8:00 PM via Google Meet. The event featured an esteemed keynote speaker, Mr. Sameep Shastri, Grandson of India’s 2nd Prime Minister, Shri Lal Bahadur Shastri Ji, Chairman of the Indian Institute of Governance & Leadership, President of CYL International, and Global Youth Leader at BRICS CCI.

The session offered participants a once-in-a-lifetime opportunity to learn from a leader carrying forward a remarkable legacy of integrity, leadership, and service. Mr. Shastri shared valuable insights on governance, youth empowerment, and the importance of purposeful leadership in today’s dynamic world. He emphasized the role of young minds in nation-building and encouraged Rotaractors to lead with values, vision, and responsibility.

The event witnessed active participation from multiple clubs across districts, fulfilling the collaboration criteria of a minimum of seven members per club. Attendees found the session deeply motivating, gaining perspectives on how legacy and leadership go hand in hand in creating lasting impact.

Under the leadership of Rtr. Vanshika Kapoor (President), Rtr. Kinjal Goyal (Secretary), Rtr. Christie Grover (Vice President), and Rtr. Bhumi Gulati (Vocational Services Director), the event concluded successfully, leaving participants inspired to lead with purpose and uphold the values of true leadership.",JOINT_INITIATIVE,Online (G-Meet),22/10/2025,22/10/2025,Rotaract Club of Rever RID - 3011,KSSEM,213238,Zone Ashwa,Manoj B,manojbkssem@gmail.com,,,Supporting Education,"Public Image, Professional Development",0,0,0,146,146,2,119,No,Yes,No,https://media.3191-2525.clubstack.tixora.space/uploads/TSgRCi2mf72dYacShR0Hx.jpg,https://media.3191-2525.clubstack.tixora.space/uploads/o4z-8nJWkigByjKcxJAWs.jpg | https://media.3191-2525.clubstack.tixora.space/uploads/4FiFxY401Re4xHt2JRKSg.jpg | https://media.3191-2525.clubstack.tixora.space/uploads/7z55h9KtRwQBkmEnhtwrG.jpg | https://media.3191-2525.clubstack.tixora.space/uploads/n-ABZnc0e2VlMfRONsyP6.jpg | https://media.3191-2525.clubstack.tixora.space/uploads/AEZLSh4JrWjHRaKBmNLy3.jpg,2025-11-07T13:45:43.804Z,2025-11-07T13:45:43.804Z
fcc902a7-e565-4119-96e3-cb412e102bab,ADHIKAR – Multi-District Open Panel Discussion,"The ADHIKAR – Multi-District Open Panel Discussion on Voting Awareness was successfully organized by the Rotaract Club of JIT, RID 3030 on 18th October 2025 from 7:00 PM to 8:00 PM via an online platform. Conducted under District 3030’s initiative – Project Adhikar, the event focused on raising awareness about the importance of voting and encouraging youth to take an active role in the democratic process.

The panel discussion provided an engaging platform for participants to understand the significance of every vote and the responsibility that comes with it. The speakers shed light on topics such as voter education, the impact of informed decision-making, and the power of collective participation in shaping the nation’s future. Discussions also highlighted the role of youth in strengthening democracy and promoting civic responsibility.

The event witnessed enthusiastic participation from multiple Rotaract clubs across districts, fulfilling the collaboration requirement of at least five members per club. Participants found the session thought-provoking and inspiring, appreciating the initiative for promoting awareness about their fundamental right — the right to vote.

The session concluded successfully under the leadership of Rtr. Grisha Kingrani (President), Rtr. Parineeta Kapse (Event Chair), and Rtr. Yash Tanwani (Event Chair), marking a meaningful step toward youth empowerment and active citizenship.",JOINT_INITIATIVE,Online (G-Meet),18/10/2025,18/10/2025,,KSSEM,213238,Zone Ashwa,Manoj B,manojbkssem@gmail.com,,,"Growing Local Economies, Supporting Education","Public Image, Public Relations",0,0,0,80,80,2,81,No,Yes,No,https://media.3191-2525.clubstack.tixora.space/uploads/k3D6ZAWIQVP_Zijv3_igy.jpg,https://media.3191-2525.clubstack.tixora.space/uploads/4uHzLh3c7Zxk_8t3LDVPs.jpg | https://media.3191-2525.clubstack.tixora.space/uploads/tufdbz6BtCmQU8SC2Rp5b.jpg,2025-11-07T13:41:24.103Z,2025-11-07T13:47:30.478Z
fd2712fe-937e-4168-b72b-eeb812e1a8fe,SpeakEasy,"The SpeakEasy: From Nervous to Noteworthy online public speaking session, organized by the Rotaract Club of Bangalore West, was successfully conducted on 17th October 2025 at 7:00 PM onwards. The session aimed to help participants overcome stage fright, develop confidence, and enhance their communication skills to express themselves effectively and impactfully.

The session was led by Ms. Hemalatha, who shared valuable insights on how to transform nervousness into confidence while speaking in front of an audience. She discussed key aspects of public speaking such as clarity, body language, tone modulation, and audience engagement. Through practical tips and interactive examples, participants learned how to structure their thoughts, speak naturally, and make a lasting impression.

The event saw active participation from both community-based and institution-based clubs, meeting the collaboration criteria of a minimum of five and ten members respectively. Non-Rotaractors also participated enthusiastically, making the session diverse and engaging.

The participants appreciated the speaker’s approachable style and the session’s practical focus, which made the learning experience both inspiring and enjoyable. The event concluded with appreciation for the organizing team — Rtr. Shankar Prabhudev (President), Rtr. Sansita Rao (Secretary), Rtr. Lakshmi S Iyengar, and Rtr. Dhruti V Wadki (Professional Development Directors) — for delivering an empowering and confidence-boosting session.",JOINT_INITIATIVE,Online (G-Meet),17/10/2025,17/10/2025,Rotaract Club of Bangalore West,KSSEM,213238,Zone Ashwa,Manoj B,manojbkssem@gmail.com,,,Supporting Education,"Professional Development, Public Relations",0,0,0,88,80,10,88,No,Yes,No,https://media.3191-2525.clubstack.tixora.space/uploads/Qj7CO5Di-WRssmCGqcgCa.jpg,https://media.3191-2525.clubstack.tixora.space/uploads/m-E9ickrc4HBEPIRGtoxe.jpg | https://media.3191-2525.clubstack.tixora.space/uploads/M898jvMEem__opMAlJcXo.jpg | https://media.3191-2525.clubstack.tixora.space/uploads/zAN_edAMFPk7Nv3MWGvys.jpg | https://media.3191-2525.clubstack.tixora.space/uploads/WdVoXZCfoY8MAtrauA2S6.jpg,2025-11-07T13:12:40.797Z,2025-11-07T13:12:40.797Z
3e998eff-cee6-4188-a9a7-1fcff2659a66,Mastering the Art of Public Speaking,"The Mastering the Art of Public Speaking online session, organized by the Rotaract Club of Delhi Rajdhani, RID 3011 in association with the Rotaract Club of Ashoka Artisans, RID 3012, was successfully conducted on 12th October 2025 at 8:00 PM via Google Meet. The session was led by Mr. Kartik Deshwal, a renowned Public Speaking and Debate Mentor, Commerce Educator, and experienced MUN Judge and Delegate.

The event aimed to help participants overcome stage fear, improve communication confidence, and develop impactful public speaking skills. Through an interactive and engaging format, Mr. Kartik guided attendees on techniques to speak naturally without memorization, maintain strong stage presence, and effectively use body language, voice modulation, and eye contact. Participants also took part in hands-on activities such as storytelling, impromptu speaking, and short interactive drills that boosted their confidence and spontaneity.

The session encouraged active participation and created a comfortable environment for learning through practice and feedback. Attendees appreciated the speaker’s relatable examples and practical tips on managing nervousness and handling on-stage mistakes.

With collaboration participation from multiple clubs, the event successfully met its objectives of enhancing communication and leadership skills, leaving participants inspired to speak with clarity, confidence, and purpose.",JOINT_INITIATIVE,Online (G-Meet),12/10/2025,12/10/2025,"Rotaract Club of Delhi Rajdhani, RID 3011",KSSEM,213238,Zone Ashwa,Manoj B,manojbkssem@gmail.com,,,Supporting Education,Professional Development,0,0,0,100,100,2,101,No,Yes,No,https://media.3191-2525.clubstack.tixora.space/uploads/DwyF0oihkmqbfL_JTekBP.jpg,https://media.3191-2525.clubstack.tixora.space/uploads/dEQr7aYBJgjnluNWhIyYo.jpg | https://media.3191-2525.clubstack.tixora.space/uploads/w3Dtn5Bi2eAgYct9haNGm.jpg | https://media.3191-2525.clubstack.tixora.space/uploads/gGgsLLs5RZGXtSyPChzwx.jpg | https://media.3191-2525.clubstack.tixora.space/uploads/KydrhOSxia1ol4FxHDKw-.jpg | https://media.3191-2525.clubstack.tixora.space/uploads/ok6NhNuE6qDfOMVLc6v77.jpg,2025-11-07T13:07:00.061Z,2025-11-07T13:07:00.061Z
